{
  "schema_version": "0.1.0",
  "experiment_id": "TTPT-20260927-B001",
  "session_type": "benign",
  "technique_id": null,
  "technique_name": null,
  "emulation": null,
  "host": {
    "host_id": "HOST-WIN02",
    "platform": "windows",
    "os_version": "Windows 11",
    "snapshot_id": "clean-v1"
  },
  "window": {
    "started_at": "2026-09-27T11:00:00+03:00",
    "ended_at": "2026-09-27T11:10:00+03:00"
  },
  "authorization": {
    "scope": "owned-isolated-lab",
    "approved": true,
    "network_isolated": true
  },
  "collection": {
    "sources": ["sysmon", "windows-event-log"],
    "sysmon_config_sha256": "aaaaaaaaaaaaaaaaaaaaaaaaaaaaaaaaaaaaaaaaaaaaaaaaaaaaaaaaaaaaaaaa"
  },
  "artifacts": {
    "event_log": "data/raw/TTPT-20260927-B001/events.jsonl"
  },
  "notes": "Normal dosya ve uygulama kullanım oturumu."
}

